{
  "record_format_version": "v0.1",
  "artifact_type": "TRANSACTION_RECEIPT",
  "transaction_id": "FILE-0001-TXN-0005",
  "case_id": "FILE-0001",
  "terminal_outcome": "COMMITTED",
  "initiated_by_actor_id": "ACTOR-0001",
  "initiated_by_actor_role": "Image Agent",
  "recorded_by_actor_id": "ACTOR-0001",
  "recorded_by_actor_role": "Image Agent",
  "terminal_at": "2026-09-19T15:14:36.791100Z",
  "receipt_created_at": "2026-09-19T15:14:36.830046Z",
  "lease_evidence": {
    "lease_path": ".projectorigin/leases/FILE-0001.json",
    "lease_sha256": "a088e20a4c95823f8ba99c8bb6b94654c3e52bb4c62fd99d2b560aea3ad56aa4",
    "allocation_record_ref": ".projectorigin/transaction-allocations/FILE-0001/FILE-0001-TXN-0005.json",
    "allocation_record_sha256": "d9aec7a4fb8bb4c5d3b3a89f21493de9fa27167185afb66610af18bdb2a2aad5",
    "holder_actor_id": "ACTOR-0001",
    "holder_actor_role": "Image Agent",
    "acquired_at": "2026-09-19T15:14:36.166158Z",
    "expires_at": "2026-09-19T16:14:36.160688Z"
  },
  "write_results": [
    {
      "target_path": "cases/FILE-0001/registration-validations/FILE-0001-IMG-0004/FILE-0001-TXN-0005.json",
      "operation": "CREATE",
      "pre_write_state": {
        "existence": "ABSENT",
        "sha256": null
      },
      "post_write_state": {
        "existence": "EXISTS",
        "sha256": "8fdce75611b334ba1b5c313953a903f9352a01549e1a171578917668195b8d1d"
      },
      "result": "CREATED",
      "role": "CANONICAL_TARGET"
    },
    {
      "target_path": "cases/FILE-0001/semantic-events/FILE-0001-EVT-0005.json",
      "operation": "CREATE",
      "pre_write_state": {
        "existence": "ABSENT",
        "sha256": null
      },
      "post_write_state": {
        "existence": "EXISTS",
        "sha256": "942df6fafcffc248cafd955578e2a8736a5e79ddcaabf7730af07e6494d71e54"
      },
      "result": "CREATED",
      "role": "SEMANTIC_EVENT"
    }
  ],
  "validation_evidence": {
    "prospective_validation": {
      "status": "PASS",
      "layers": {
        "SCHEMA": "PASS",
        "SEMANTIC": "PASS",
        "CROSS_ARTIFACT": "PASS",
        "GOVERNANCE": "PASS"
      },
      "findings": []
    },
    "post_write_verification": {
      "status": "PASS",
      "layers": {
        "SCHEMA": "PASS",
        "SEMANTIC": "PASS",
        "CROSS_ARTIFACT": "PASS",
        "GOVERNANCE": "PASS"
      },
      "findings": []
    }
  },
  "semantic_event_requirement": "REQUIRED",
  "required_semantic_events": [
    {
      "event_id": "FILE-0001-EVT-0005",
      "event_type": "RECORD_CREATED",
      "record_ref": {
        "ref_id": "mechanical-validation-record",
        "artifact_type": "MECHANICAL_VALIDATION_RECORD",
        "required": true,
        "applicability": "REQUIRED",
        "artifact_id": "FILE-0001-TXN-0005",
        "repository_path": "cases/FILE-0001/registration-validations/FILE-0001-IMG-0004/FILE-0001-TXN-0005.json",
        "sha256": "8fdce75611b334ba1b5c313953a903f9352a01549e1a171578917668195b8d1d",
        "source_step": "CPW-025"
      }
    }
  ],
  "emitted_semantic_event_refs": [
    {
      "event_id": "FILE-0001-EVT-0005",
      "event_type": "RECORD_CREATED",
      "record_ref": {
        "ref_id": "mechanical-validation-record",
        "artifact_type": "MECHANICAL_VALIDATION_RECORD",
        "required": true,
        "applicability": "REQUIRED",
        "artifact_id": "FILE-0001-TXN-0005",
        "repository_path": "cases/FILE-0001/registration-validations/FILE-0001-IMG-0004/FILE-0001-TXN-0005.json",
        "sha256": "8fdce75611b334ba1b5c313953a903f9352a01549e1a171578917668195b8d1d",
        "source_step": "CPW-025"
      },
      "event_sha256": "942df6fafcffc248cafd955578e2a8736a5e79ddcaabf7730af07e6494d71e54"
    }
  ]
}
